{
    "EVENTSETTINGS": {
        "EVENTHISTORYLIMIT": 40000,
        "EVENTHISTORYTHRESHOLD": 4000
    },
    "INTERVAL": 2000,
    "RUNTIMES": {
        "IFP01": {
            "ENABLED": true,
            "NETID": "192.168.1.2.1.1",
            "PORT": 851
        }
    },
    "USERLEVEL": {
        "LEVEL_ADVANCED": [
            "Advanced"
        ],
        "LEVEL_BASIC": [
            "Basic"
        ],
        "LEVEL_EXPERT": [
            "Expert"
        ],
        "LEVEL_GUEST": [
            "Guest"
        ],
        "LEVEL_INTERNAL": [
            "Internal",
            "__SystemAdministrators"
        ]
    }
}